{
  "songId": "zuguo-zuguo-women-ai-ni",
  "title": "祖国祖国我们爱你",
  "tonic": "C",
  "key": "C major",
  "mode": "major",
  "meter": {
    "beats": 2,
    "unit": 4
  },
  "bpm": 72,
  "lyricsText": "小小蜻蜓穿花衣，红黄蓝绿多美丽。小朋友们多么欢喜，画个图画比一比。画小鸟飞在蓝天里，画小草长在春天里。你画太阳，我画国旗。祖国祖国，我们爱你。祖国祖国，我们爱你。",
  "measures": [
    {
      "number": 1,
      "pickup": false,
      "notes": [
        {
          "noteId": "m001_n001",
          "degree": 3,
          "octave": 0,
          "pitch": "E4",
          "absolutePitch": "E4",
          "midiNumber": 64,
          "frequency": 329.628,
          "solfege": "mi",
          "duration": 0.5,
          "beat": 0,
          "startBeat": 0,
          "rest": false,
          "lyric": "小",
          "lyricSyllableId": "syllable_001",
          "lyricContinuation": false,
          "confidence": 1
        },
        {
          "noteId": "m001_n002",
          "degree": 4,
          "octave": 0,
          "pitch": "F4",
          "absolutePitch": "F4",
          "midiNumber": 65,
          "frequency": 349.228,
          "solfege": "fa",
          "duration": 0.5,
          "beat": 0.5,
          "startBeat": 0.5,
          "rest": false,
          "lyric": "小",
          "lyricSyllableId": "syllable_002",
          "lyricContinuation": false,
          "confidence": 1
        },
        {
          "noteId": "m001_n003",
          "degree": 5,
          "octave": 0,
          "pitch": "G4",
          "absolutePitch": "G4",
          "midiNumber": 67,
          "frequency": 391.995,
          "solfege": "sol",
          "duration": 0.5,
          "beat": 1,
          "startBeat": 1,
          "rest": false,
          "lyric": "蜡",
          "lyricSyllableId": "syllable_003",
          "lyricContinuation": false,
          "confidence": 1
        },
        {
          "noteId": "m001_n004",
          "degree": 6,
          "octave": 0,
          "pitch": "A4",
          "absolutePitch": "A4",
          "midiNumber": 69,
          "frequency": 440,
          "solfege": "la",
          "duration": 0.5,
          "beat": 1.5,
          "startBeat": 1.5,
          "rest": false,
          "lyric": null,
          "lyricSyllableId": "syllable_003",
          "lyricContinuation": true,
          "confidence": 1
        }
      ]
    },
    {
      "number": 2,
      "pickup": false,
      "notes": [
        {
          "noteId": "m002_n001",
          "degree": 5,
          "octave": 0,
          "pitch": "G4",
          "absolutePitch": "G4",
          "midiNumber": 67,
          "frequency": 391.995,
          "solfege": "sol",
          "duration": 1,
          "beat": 0,
          "startBeat": 2,
          "rest": false,
          "lyric": "笔",
          "lyricSyllableId": "syllable_005",
          "lyricContinuation": false,
          "confidence": 1
        },
        {
          "noteId": "m002_n002",
          "degree": 0,
          "octave": 0,
          "pitch": null,
          "absolutePitch": null,
          "midiNumber": null,
          "frequency": null,
          "solfege": "rest",
          "duration": 1,
          "beat": 1,
          "startBeat": 3,
          "rest": true,
          "lyric": null,
          "lyricSyllableId": null,
          "lyricContinuation": false,
          "confidence": 1
        }
      ]
    },
    {
      "number": 3,
      "pickup": false,
      "notes": [
        {
          "noteId": "m003_n001",
          "degree": 3,
          "octave": 0,
          "pitch": "E4",
          "absolutePitch": "E4",
          "midiNumber": 64,
          "frequency": 329.628,
          "solfege": "mi",
          "duration": 0.5,
          "beat": 0,
          "startBeat": 4,
          "rest": false,
          "lyric": "穿",
          "lyricSyllableId": "syllable_006",
          "lyricContinuation": false,
          "confidence": 1
        },
        {
          "noteId": "m003_n002",
          "degree": 4,
          "octave": 0,
          "pitch": "F4",
          "absolutePitch": "F4",
          "midiNumber": 65,
          "frequency": 349.228,
          "solfege": "fa",
          "duration": 0.5,
          "beat": 0.5,
          "startBeat": 4.5,
          "rest": false,
          "lyric": null,
          "lyricSyllableId": "syllable_006",
          "lyricContinuation": true,
          "confidence": 1
        },
        {
          "noteId": "m003_n003",
          "degree": 5,
          "octave": 0,
          "pitch": "G4",
          "absolutePitch": "G4",
          "midiNumber": 67,
          "frequency": 391.995,
          "solfege": "sol",
          "duration": 0.5,
          "beat": 1,
          "startBeat": 5,
          "rest": false,
          "lyric": "花",
          "lyricSyllableId": "syllable_007",
          "lyricContinuation": false,
          "confidence": 1
        },
        {
          "noteId": "m003_n004",
          "degree": 6,
          "octave": 0,
          "pitch": "A4",
          "absolutePitch": "A4",
          "midiNumber": 69,
          "frequency": 440,
          "solfege": "la",
          "duration": 0.5,
          "beat": 1.5,
          "startBeat": 5.5,
          "rest": false,
          "lyric": null,
          "lyricSyllableId": "syllable_007",
          "lyricContinuation": true,
          "confidence": 1
        }
      ]
    },
    {
      "number": 4,
      "pickup": false,
      "notes": [
        {
          "noteId": "m004_n001",
          "degree": 5,
          "octave": 0,
          "pitch": "G4",
          "absolutePitch": "G4",
          "midiNumber": 67,
          "frequency": 391.995,
          "solfege": "sol",
          "duration": 1,
          "beat": 0,
          "startBeat": 6,
          "rest": false,
          "lyric": "衣",
          "lyricSyllableId": "syllable_008",
          "lyricContinuation": false,
          "confidence": 1
        },
        {
          "noteId": "m004_n002",
          "degree": 0,
          "octave": 0,
          "pitch": null,
          "absolutePitch": null,
          "midiNumber": null,
          "frequency": null,
          "solfege": "rest",
          "duration": 1,
          "beat": 1,
          "startBeat": 7,
          "rest": true,
          "lyric": null,
          "lyricSyllableId": null,
          "lyricContinuation": false,
          "confidence": 1
        }
      ]
    },
    {
      "number": 5,
      "pickup": false,
      "notes": [
        {
          "noteId": "m005_n001",
          "degree": 3,
          "octave": 0,
          "pitch": "E4",
          "absolutePitch": "E4",
          "midiNumber": 64,
          "frequency": 329.628,
          "solfege": "mi",
          "duration": 0.5,
          "beat": 0,
          "startBeat": 8,
          "rest": false,
          "lyric": "红",
          "lyricSyllableId": "syllable_009",
          "lyricContinuation": false,
          "confidence": 1
        },
        {
          "noteId": "m005_n002",
          "degree": 4,
          "octave": 0,
          "pitch": "F4",
          "absolutePitch": "F4",
          "midiNumber": 65,
          "frequency": 349.228,
          "solfege": "fa",
          "duration": 0.5,
          "beat": 0.5,
          "startBeat": 8.5,
          "rest": false,
          "lyric": "黄",
          "lyricSyllableId": "syllable_010",
          "lyricContinuation": false,
          "confidence": 1
        },
        {
          "noteId": "m005_n003",
          "degree": 5,
          "octave": 0,
          "pitch": "G4",
          "absolutePitch": "G4",
          "midiNumber": 67,
          "frequency": 391.995,
          "solfege": "sol",
          "duration": 0.5,
          "beat": 1,
          "startBeat": 9,
          "rest": false,
          "lyric": "蓝",
          "lyricSyllableId": "syllable_011",
          "lyricContinuation": false,
          "confidence": 1
        },
        {
          "noteId": "m005_n004",
          "degree": 1,
          "octave": 1,
          "pitch": "C5",
          "absolutePitch": "C5",
          "midiNumber": 72,
          "frequency": 523.251,
          "solfege": "do",
          "duration": 0.5,
          "beat": 1.5,
          "startBeat": 9.5,
          "rest": false,
          "lyric": "绿",
          "lyricSyllableId": "syllable_012",
          "lyricContinuation": false,
          "confidence": 1
        }
      ]
    },
    {
      "number": 6,
      "pickup": false,
      "notes": [
        {
          "noteId": "m006_n001",
          "degree": 7,
          "octave": 0,
          "pitch": "B4",
          "absolutePitch": "B4",
          "midiNumber": 71,
          "frequency": 493.883,
          "solfege": "si",
          "duration": 1,
          "beat": 0,
          "startBeat": 10,
          "rest": false,
          "lyric": "多",
          "lyricSyllableId": "syllable_013",
          "lyricContinuation": false,
          "confidence": 1
        },
        {
          "noteId": "m006_n002",
          "degree": 6,
          "octave": 0,
          "pitch": "A4",
          "absolutePitch": "A4",
          "midiNumber": 69,
          "frequency": 440,
          "solfege": "la",
          "duration": 1,
          "beat": 1,
          "startBeat": 11,
          "rest": false,
          "lyric": "美",
          "lyricSyllableId": "syllable_014",
          "lyricContinuation": false,
          "confidence": 1
        }
      ]
    },
    {
      "number": 7,
      "pickup": false,
      "notes": [
        {
          "noteId": "m007_n001",
          "degree": 5,
          "octave": 0,
          "pitch": "G4",
          "absolutePitch": "G4",
          "midiNumber": 67,
          "frequency": 391.995,
          "solfege": "sol",
          "duration": 2,
          "beat": 0,
          "startBeat": 12,
          "rest": false,
          "lyric": "丽",
          "lyricSyllableId": "syllable_015",
          "lyricContinuation": false,
          "confidence": 1
        }
      ]
    },
    {
      "number": 8,
      "pickup": false,
      "notes": [
        {